{
  "schemaVersion": "ruleoak.governance.v1",
  "recordType": "AuditEvent",
  "eventId": "py-event-001",
  "runId": "py-run-001",
  "eventType": "policy_checked",
  "action": "send_external_message",
  "subject": "customer-update-draft",
  "actor": "python-local-user",
  "policyDecision": "approval_required",
  "createdAt": "2026-01-01T00:00:25.000Z",
  "metadata": {
    "emittedBy": "ruleoak-py"
  }
}
