{
  "schemaVersion": "ruleoak.governance.v1",
  "recordType": "AuditEvent",
  "eventId": "conformance-audit-001",
  "runId": "conformance-run-001",
  "eventType": "run_started",
  "action": null,
  "subject": null,
  "actor": "ruleoak",
  "policyDecision": null,
  "evidenceId": null,
  "approvalId": null,
  "metadata": {
    "workflow": "protocol-v1-fixture"
  },
  "createdAt": "2026-01-01T00:00:00.000Z",
  "sequence": 0,
  "previousHash": null,
  "eventHash": "7eff25822467b59e1823fcf6a1dc16319b2b195a811ca683e7635e0cd8620671"
}
